<?xml version="1.0" encoding="US-ASCII"?>
<!DOCTYPE translation-bundle PUBLIC "-//XINS//DTD XINS Translation Bundle 1.0//EN" "http://xins.sourceforge.net/dtd/translation-bundle_1_0.dtd">

<translation-bundle>
	<translation entry="10000">Found the number <value-of-param name="number" /> in the parameter <value-of-param name="parameter" format="quoted" />.</translation>
	<translation entry="10001">The system could not find any number.</translation>
	<translation entry="10002">Odd: <value-of-param name="odd"/>, more than 1000: <value-of-param name="moreThousands"/>, square: <value-of-param name="square"/>, with thread: <value-of-param name="thread" format="quoted"/>, time: <value-of-param name="date"/> .</translation>
</translation-bundle>
