<?xml version="1.0" encoding="US-ASCII" ?>
<!DOCTYPE translation-bundle PUBLIC "-//XINS//DTD XINS Translation Bundle 1.0//EN" "http://xins.sourceforge.net/dtd/translation-bundle_1_0.dtd">
<!--
 -*- mode: Fundamental; tab-width: 4; -*-
 ex:ts=4

 $Id$
-->

<translation-bundle>
	<translation entry="2000">Unable to convert the input from the specified reader to XML<value-of-param name="detail" />.</translation>
	<translation entry="2001">Found &lt;<value-of-param name="element_name" />/&gt; with an empty key and empty value.</translation>
	<translation entry="2002">Found &lt;<value-of-param name="element_name" />/&gt; with an empty key.</translation>
	<translation entry="2003">Found &lt;<value-of-param name="element_name" />/&gt; with <value-of-param name="key_attribute" /> <value-of-param name="key" format="quoted" /> but an empty value.</translation>
	<translation entry="2004">Found &lt;<value-of-param name="element_name" />/&gt; with <value-of-param name="key_attribute" /> <value-of-param name="key" format="quoted" /> and value <value-of-param name="value" format="quoted" />.</translation>
	<translation entry="2005">Unable to convert the specified character string to XML<value-of-param name="detail" />.</translation>
	<translation entry="2006">The returned XML is invalid. The type of the root element is <value-of-param name="element_name" format="quoted" /> instead of "result".</translation>
	<translation entry="2007">Caught <value-of-param name="class_name" /> while releasing HTTP connection after request failed. Ignoring this exception so the original exception is not hidden.</translation>
	<translation entry="2008">HTTP code <value-of-param name="code" />.</translation>
	<translation entry="2009">Failed to read the response body.</translation>
	<translation entry="2010">Unexpected <value-of-param name="class_name" /> caught while calling doCall(org.xins.util.service.CallRequest).</translation>
</translation-bundle>
